statement ok
set streaming_parallelism=4;

statement ok
CREATE TABLE t_v3_derive_pk_users (user_id int PRIMARY KEY, name varchar);

statement ok
CREATE TABLE t_v3_derive_pk_orders (order_id bigint PRIMARY KEY, user_id int, product varchar, amount int);

statement ok
CREATE MATERIALIZED VIEW mv_v3_derive_pk AS
SELECT u.user_id, u.name, o.order_id, o.product, o.amount
FROM t_v3_derive_pk_users u JOIN t_v3_derive_pk_orders o ON u.user_id = o.user_id;

statement ok
CREATE SINK s_v3_derive_pk FROM mv_v3_derive_pk
WITH (
    connector = 'iceberg',
    type = 'upsert',
    force_append_only = 'false',
    catalog.name = 'demo',
    database.name = 'public',
    table.name = 'derive_pk_v3_pk_index_table',
    catalog.type = 'storage',
    warehouse.path = 's3a://hummock001/iceberg_v3',
    s3.endpoint = 'http://127.0.0.1:9301',
    s3.region = 'us-east-1',
    s3.access.key = 'hummockadmin',
    s3.secret.key = 'hummockadmin',
    create_table_if_not_exists = 'true',
    primary_key = 'user_id',
    write_mode = 'merge-on-read',
    format_version = '3',
    enable_pk_index = 'true'
);

statement ok
INSERT INTO t_v3_derive_pk_users VALUES (1, 'Alice'), (2, 'Bob');

statement ok
FLUSH;

statement ok
INSERT INTO t_v3_derive_pk_orders VALUES
    (100, 1, 'book', 50),
    (101, 1, 'pen', 5),
    (200, 2, 'lamp', 30);

statement ok
FLUSH;

statement ok
CREATE SOURCE iceberg_derive_pk_source WITH (
    connector = 'iceberg',
    database.name = 'public',
    table.name = 'derive_pk_v3_pk_index_table',
    catalog.name = 'demo',
    catalog.type = 'storage',
    warehouse.path = 's3a://hummock001/iceberg_v3',
    s3.endpoint = 'http://127.0.0.1:9301',
    s3.region = 'us-east-1',
    s3.access.key = 'hummockadmin',
    s3.secret.key = 'hummockadmin'
);

# Both orders for user 1 must be preserved (derive-pk extends the iceberg pk
# beyond user_id so that rows sharing the same declared pk are not overwritten).
query ????? rowsort retry 11 backoff 1s
select user_id, name, order_id, product, amount from iceberg_derive_pk_source;
----
1 Alice 100 book 50
1 Alice 101 pen 5
2 Bob 200 lamp 30

statement ok
UPDATE t_v3_derive_pk_orders SET amount = 60 WHERE order_id = 100;

statement ok
FLUSH;

# After UPDATE, order 100 reflects the new amount; order 101 untouched.
query ????? rowsort retry 11 backoff 1s
select user_id, name, order_id, product, amount from iceberg_derive_pk_source;
----
1 Alice 100 book 60
1 Alice 101 pen 5
2 Bob 200 lamp 30

statement ok
DELETE FROM t_v3_derive_pk_orders WHERE order_id = 101;

statement ok
FLUSH;

# After DELETE, only order 100 (Alice) and order 200 (Bob) remain.
query ????? rowsort retry 11 backoff 1s
select user_id, name, order_id, product, amount from iceberg_derive_pk_source;
----
1 Alice 100 book 60
2 Bob 200 lamp 30

query T retry 11 backoff 1s
select count(*) > 0 from rw_iceberg_files
where source_name = 'iceberg_derive_pk_source'
  and content = 'PositionDeletes'
  and file_format = 'puffin';
----
t

query T retry 11 backoff 1s
select count(*) = 0 from rw_iceberg_files
where source_name = 'iceberg_derive_pk_source'
  and content = 'EqualityDeletes';
----
t

statement ok
DROP SOURCE iceberg_derive_pk_source;

statement ok
DROP SINK s_v3_derive_pk;

statement ok
DROP MATERIALIZED VIEW mv_v3_derive_pk;

statement ok
DROP TABLE t_v3_derive_pk_orders;

statement ok
DROP TABLE t_v3_derive_pk_users;

# ----- pk-less upstream: hidden _row_id is packed into _rw_extra_pk -----

statement ok
CREATE TABLE t_v3_derive_pk_pkless (item_id int, label varchar);

statement ok
CREATE SINK s_v3_derive_pk_pkless AS
select item_id, label from t_v3_derive_pk_pkless
WITH (
    connector = 'iceberg',
    type = 'upsert',
    force_append_only = 'false',
    catalog.name = 'demo',
    database.name = 'public',
    table.name = 'derive_pk_pkless_v3_pk_index_table',
    catalog.type = 'storage',
    warehouse.path = 's3a://hummock001/iceberg_v3',
    s3.endpoint = 'http://127.0.0.1:9301',
    s3.region = 'us-east-1',
    s3.access.key = 'hummockadmin',
    s3.secret.key = 'hummockadmin',
    create_table_if_not_exists = 'true',
    primary_key = 'item_id',
    write_mode = 'merge-on-read',
    format_version = '3',
    enable_pk_index = 'true'
);

statement ok
INSERT INTO t_v3_derive_pk_pkless VALUES (1, 'a'), (1, 'b'), (2, 'c');

statement ok
FLUSH;

statement ok
CREATE SOURCE iceberg_derive_pk_pkless_source WITH (
    connector = 'iceberg',
    database.name = 'public',
    table.name = 'derive_pk_pkless_v3_pk_index_table',
    catalog.name = 'demo',
    catalog.type = 'storage',
    warehouse.path = 's3a://hummock001/iceberg_v3',
    s3.endpoint = 'http://127.0.0.1:9301',
    s3.region = 'us-east-1',
    s3.access.key = 'hummockadmin',
    s3.secret.key = 'hummockadmin'
);

# Both rows with item_id=1 must be preserved; iceberg gains a hidden
# _rw_extra_pk column whose bytes distinguish them under the extended pk.
query IT rowsort retry 11 backoff 1s
select item_id, label from iceberg_derive_pk_pkless_source;
----
1 a
1 b
2 c

# Confirm the synthetic _rw_extra_pk column is populated and unique per row.
query I retry 11 backoff 1s
select count(distinct _rw_extra_pk) from iceberg_derive_pk_pkless_source;
----
3

statement ok
DELETE FROM t_v3_derive_pk_pkless WHERE label = 'a';

statement ok
FLUSH;

query IT rowsort retry 11 backoff 1s
select item_id, label from iceberg_derive_pk_pkless_source;
----
1 b
2 c

statement ok
DROP SOURCE iceberg_derive_pk_pkless_source;

statement ok
DROP SINK s_v3_derive_pk_pkless;

statement ok
DROP TABLE t_v3_derive_pk_pkless;
